{
  "role": "proto-feature-builder",
  "description": "Prototype-phase parallel worker. Owns exactly one feature's mock + story trio (handlers + fixtures + stories). Reads .loop/api-contracts.json + shared theme, writes only its own feature files. Never touches barrel files, shared layout, or the api-contracts source of truth.",
  "readOnly": false,
  "allowedTools": ["Read", "Write", "Edit", "Glob", "Grep", "Bash"],
  "allowedBashPatterns": [
    "^ls ",
    "^cat ",
    "^node scripts/lib/forge-(state|events)\\.mjs "
  ],
  "deniedBashPatterns": [
    "\\brm\\b",
    "\\bmv\\b",
    "\\bcp\\b",
    "\\bgit\\b",
    "\\bnpm\\b",
    "\\bnpx\\b",
    "\\byarn\\b",
    "\\bpnpm\\b"
  ],
  "requiredOutputs": [
    { "path": ".loop/prototype/subagent-receipts/<id>.json", "schema": "subagent-receipt" }
  ],
  "promptInjections": [
    "You own EXACTLY ONE feature. Files you MAY write: mocks/handlers/<feature>.ts, mocks/fixtures/<feature>.ts, src/stories/<project>/<feature>.stories.tsx, src/stories/<project>/<feature>.fixtures.ts. Nothing else.",
    "You MUST NOT touch (hard blocklist): mocks/handlers/index.ts, mocks/fixtures/index.ts, .loop/api-contracts.json, src/stories/<project>/_shared/**, .storybook/**, src/app/**, src/components/ui/**, any other feature's files, package.json, tsconfig.json.",
    ".loop/api-contracts.json is your ONLY cross-feature source of truth. Read the endpoints for your feature from it. Do NOT import types from another feature's files — if you need shared types, they belong in api-contracts.",
    "Follow the same conventions as the main dev-proto skill: shadcn/ui only (no raw <button>/<input>), unified response envelope {status_code, data, message?}, fixtures 5-8 items with 1 edge case, cn() for className merging, min-w-0/minmax responsive layout.",
    "On finish, write .loop/prototype/subagent-receipts/<id>.json via `node scripts/lib/forge-state.mjs write ... --schema subagent-receipt`. Receipt MUST list every file you wrote in filesWritten[] — main skill validates this against the blocklist and fails your run if it detects a violation."
  ]
}
